{
  "$schema": "./registry-meta-schema-v4.json",
  "registrySchemaVersion": "ifccad.ifcdr.registry.v4",
  "ifcdrVersion": "0.9.0",
  "types": {
    "entityId": {
      "kind": "scalar",
      "base": "uint64",
      "minimum": 1
    },
    "ifcxId": {
      "kind": "scalar",
      "base": "string",
      "minLength": 1
    },
    "unit": {
      "kind": "enum",
      "values": [
        "unitless",
        "in",
        "ft",
        "mi",
        "mm",
        "cm",
        "m",
        "km",
        "microin",
        "mil",
        "yd",
        "angstrom",
        "nm",
        "um",
        "dm",
        "dam",
        "hm",
        "Gm",
        "au",
        "ly",
        "pc",
        "usSurveyFoot",
        "usSurveyInch",
        "usSurveyYard",
        "usSurveyMile"
      ]
    },
    "appearanceMode": {
      "kind": "enum",
      "values": [
        "ByLayer",
        "Explicit",
        "ByBlock"
      ]
    },
    "point2": {
      "kind": "record",
      "fields": [
        {
          "name": "x",
          "valueType": "float64",
          "nullable": false
        },
        {
          "name": "y",
          "valueType": "float64",
          "nullable": false
        }
      ]
    },
    "vertices": {
      "kind": "sequence",
      "items": "point2",
      "minItems": 2
    },
    "orderEntries": {
      "kind": "sequence",
      "items": "entityId",
      "minItems": 0
    },
    "rgb": {
      "kind": "sequence",
      "items": "uint8",
      "minItems": 3,
      "maxItems": 3
    },
    "indexedColor": {
      "kind": "record",
      "fields": [
        {
          "name": "system",
          "valueType": "nonEmptyString",
          "nullable": false
        },
        {
          "name": "index",
          "valueType": "uint64",
          "nullable": false
        }
      ]
    },
    "namedColor": {
      "kind": "record",
      "fields": [
        {
          "name": "catalog",
          "valueType": "nonEmptyString",
          "nullable": false
        },
        {
          "name": "name",
          "valueType": "nonEmptyString",
          "nullable": false
        }
      ]
    },
    "color": {
      "kind": "record",
      "fields": [
        {
          "name": "rgb",
          "valueType": "rgb",
          "nullable": false
        },
        {
          "name": "indexedColor",
          "valueType": "indexedColor",
          "nullable": false,
          "optional": true
        },
        {
          "name": "namedColor",
          "valueType": "namedColor",
          "nullable": false,
          "optional": true
        }
      ]
    },
    "nonEmptyString": {
      "kind": "scalar",
      "base": "string",
      "minLength": 1
    },
    "opacity": {
      "kind": "scalar",
      "base": "float64",
      "minimum": 0,
      "maximum": 1
    },
    "lineWeight": {
      "kind": "scalar",
      "base": "float64",
      "minimum": 0
    },
    "point3": {
      "kind": "record",
      "fields": [
        {
          "name": "x",
          "valueType": "float64",
          "nullable": false
        },
        {
          "name": "y",
          "valueType": "float64",
          "nullable": false
        },
        {
          "name": "z",
          "valueType": "float64",
          "nullable": false
        }
      ]
    },
    "vector3": {
      "kind": "record",
      "fields": [
        {
          "name": "x",
          "valueType": "float64",
          "nullable": false
        },
        {
          "name": "y",
          "valueType": "float64",
          "nullable": false
        },
        {
          "name": "z",
          "valueType": "float64",
          "nullable": false
        }
      ]
    },
    "bounds3": {
      "kind": "record",
      "fields": [
        {
          "name": "minX",
          "valueType": "float64",
          "nullable": false
        },
        {
          "name": "minY",
          "valueType": "float64",
          "nullable": false
        },
        {
          "name": "minZ",
          "valueType": "float64",
          "nullable": false
        },
        {
          "name": "maxX",
          "valueType": "float64",
          "nullable": false
        },
        {
          "name": "maxY",
          "valueType": "float64",
          "nullable": false
        },
        {
          "name": "maxZ",
          "valueType": "float64",
          "nullable": false
        }
      ]
    },
    "planePlacement": {
      "kind": "record",
      "fields": [
        {
          "name": "origin",
          "valueType": "point3",
          "nullable": false
        },
        {
          "name": "X",
          "valueType": "vector3",
          "nullable": false
        },
        {
          "name": "Y",
          "valueType": "vector3",
          "nullable": false
        }
      ]
    },
    "scopeKind": {
      "kind": "enum",
      "values": [
        "ModelSpace",
        "PaperSpace",
        "BlockDefinition"
      ]
    },
    "blockScaling": {
      "kind": "enum",
      "values": [
        "Any",
        "Uniform"
      ]
    },
    "scale3": {
      "kind": "record",
      "fields": [
        {
          "name": "x",
          "valueType": "float64",
          "nullable": false
        },
        {
          "name": "y",
          "valueType": "float64",
          "nullable": false
        },
        {
          "name": "z",
          "valueType": "float64",
          "nullable": false
        }
      ]
    },
    "blockTransform": {
      "kind": "record",
      "fields": [
        {
          "name": "placement",
          "valueType": "planePlacement",
          "nullable": false,
          "default": {
            "origin": {
              "x": 0,
              "y": 0,
              "z": 0
            },
            "X": {
              "x": 1,
              "y": 0,
              "z": 0
            },
            "Y": {
              "x": 0,
              "y": 1,
              "z": 0
            }
          }
        },
        {
          "name": "rotation",
          "valueType": "float64",
          "nullable": false,
          "default": 0
        },
        {
          "name": "scale",
          "valueType": "scale3",
          "nullable": false,
          "default": {
            "x": 1,
            "y": 1,
            "z": 1
          }
        }
      ]
    }
  },
  "resource": {
    "schemaId": "ifccad.ifcdr.resource.v0.9.0",
    "fields": [
      {
        "name": "resourceId",
        "valueType": "nonEmptyString",
        "nullable": false
      },
      {
        "name": "unit",
        "valueType": "unit",
        "nullable": false
      },
      {
        "name": "nextEntityId",
        "valueType": "entityId",
        "nullable": false
      }
    ]
  },
  "tables": [
    {
      "name": "appearanceBinding",
      "schemaId": "ifccad.ifcdr.appearanceBinding.v2",
      "default": [],
      "fields": [
        {
          "name": "id",
          "valueType": "uint32",
          "nullable": false
        },
        {
          "name": "ifcxAppearance",
          "valueType": "ifcxId",
          "nullable": true,
          "reference": {
            "category": "ifcx",
            "target": "ifcx"
          }
        },
        {
          "name": "colorMode",
          "valueType": "appearanceMode",
          "nullable": false
        },
        {
          "name": "opacityMode",
          "valueType": "appearanceMode",
          "nullable": false
        },
        {
          "name": "linePatternMode",
          "valueType": "appearanceMode",
          "nullable": false
        },
        {
          "name": "lineWeightMode",
          "valueType": "appearanceMode",
          "nullable": false
        },
        {
          "name": "overrideId",
          "valueType": "uint32",
          "nullable": true,
          "reference": {
            "category": "tableField",
            "target": "appearanceOverride.id"
          }
        }
      ]
    },
    {
      "name": "appearanceOverride",
      "schemaId": "ifccad.ifcdr.appearanceOverride.v2",
      "default": [],
      "fields": [
        {
          "name": "id",
          "valueType": "uint32",
          "nullable": false
        },
        {
          "name": "color",
          "valueType": "color",
          "nullable": true
        },
        {
          "name": "opacity",
          "valueType": "opacity",
          "nullable": true
        },
        {
          "name": "ifcxLinePattern",
          "valueType": "ifcxId",
          "nullable": true,
          "reference": {
            "category": "ifcx",
            "target": "ifcx"
          }
        },
        {
          "name": "lineWeight",
          "valueType": "lineWeight",
          "nullable": true
        }
      ]
    },
    {
      "name": "layerBinding",
      "schemaId": "ifccad.ifcdr.layerBinding.v1",
      "default": [],
      "fields": [
        {
          "name": "id",
          "valueType": "uint32",
          "nullable": false
        },
        {
          "name": "ifcxLayer",
          "valueType": "ifcxId",
          "nullable": false,
          "reference": {
            "category": "ifcx",
            "target": "ifcx"
          }
        }
      ]
    },
    {
      "name": "scope",
      "schemaId": "ifccad.ifcdr.scope.v3",
      "default": [],
      "fields": [
        {
          "name": "id",
          "valueType": "uint32",
          "nullable": false
        },
        {
          "name": "kind",
          "valueType": "scopeKind",
          "nullable": false
        },
        {
          "name": "bounds",
          "valueType": "bounds3",
          "nullable": true
        }
      ]
    },
    {
      "name": "blockDefinition",
      "schemaId": "ifccad.ifcdr.blockDefinition.v1",
      "default": [],
      "fields": [
        {
          "name": "scopeId",
          "valueType": "uint32",
          "nullable": false,
          "reference": {
            "category": "tableField",